{
  "spindle_rpm_range": [
    10000,
    12000
  ],
  "max_feed_mm_min": 3000,
  "rigidity_class": "hobby",
  "id": "genmitsu_4040_pro_max",
  "brand": "SainSmart/Genmitsu",
  "model": "Genmitsu 4040-PRO MAX",
  "type": "CNC_Router",
  "material_presets": {},
  "supports": {},
  "safe_speed_ranges": {},
  "workarea_mm": [
    400,
    400,
    110
  ]
}