{
  "motion_system": "BedSlinger",
  "enclosed": false,
  "build_volume_mm": [
    420,
    420,
    480
  ],
  "nozzle_diameters": [
    0.4
  ],
  "max_nozzle_temp_c": 260,
  "max_bed_temp_c": 110,
  "id": "elegoo_neptune4_max",
  "brand": "ELEGOO",
  "model": "Neptune 4 Max",
  "type": "FDM",
  "material_presets": {},
  "supports": {},
  "safe_speed_ranges": {}
}