{
  "spindle_rpm_range": [
    10000,
    24000
  ],
  "max_feed_mm_min": 9000,
  "rigidity_class": "hobby_pro",
  "id": "onefinity_journeyman_elite",
  "brand": "Onefinity",
  "model": "Onefinity Journeyman Elite",
  "type": "CNC_Router",
  "material_presets": {},
  "supports": {},
  "safe_speed_ranges": {},
  "workarea_mm": [
    1219,
    813,
    130
  ]
}