{
  "motion_system": "BedSlinger",
  "enclosed": false,
  "build_volume_mm": [
    235,
    235,
    280
  ],
  "nozzle_diameters": [
    0.4
  ],
  "max_nozzle_temp_c": 260,
  "max_bed_temp_c": 110,
  "id": "elegoo_neptune3_pro",
  "brand": "ELEGOO",
  "model": "Neptune 3 Pro",
  "type": "FDM",
  "material_presets": {},
  "supports": {},
  "safe_speed_ranges": {}
}