{
  "motion_system": "CoreXY",
  "enclosed": true,
  "build_volume_mm": [
    256,
    256,
    256
  ],
  "nozzle_diameters": [
    0.4
  ],
  "max_nozzle_temp_c": 300,
  "max_bed_temp_c": 110,
  "safe_speed_ranges": {},
  "capabilities": [
    "input_shaping"
  ],
  "id": "generic_fdm_enclosed",
  "brand": "Generic",
  "model": "Generic Enclosed FDM",
  "type": "FDM",
  "material_presets": {},
  "supports": {}
}