{
  "motion_system": "BedSlinger",
  "enclosed": false,
  "build_volume_mm": [
    350,
    350,
    400
  ],
  "nozzle_diameters": [
    0.4,
    0.6
  ],
  "max_nozzle_temp_c": 285,
  "max_bed_temp_c": 100,
  "supports": {},
  "safe_speed_ranges": {},
  "material_presets": {},
  "id": "creality_ender5_max",
  "brand": "Creality",
  "model": "Ender-5 Max",
  "type": "FDM"
}