{
  "spindle_rpm_range": [
    8000,
    24000
  ],
  "rigidity_class": "hobby",
  "id": "millright_megav2_19x19",
  "brand": "MillRight CNC",
  "model": "Mega V2 (19x19)",
  "type": "CNC_Router",
  "material_presets": {},
  "supports": {},
  "safe_speed_ranges": {},
  "workarea_mm": [
    483,
    483,
    89
  ]
}