{
  "motion_system": "BedSlinger",
  "enclosed": false,
  "build_volume_mm": [
    220,
    220,
    265
  ],
  "nozzle_diameters": [
    0.4,
    0.6
  ],
  "max_nozzle_temp_c": 285,
  "max_bed_temp_c": 100,
  "supports": {},
  "safe_speed_ranges": {},
  "material_presets": {},
  "id": "creality_cr10_se",
  "brand": "Creality",
  "model": "CR-10 SE",
  "type": "FDM"
}