{
  "motion_system": "BedSlinger",
  "enclosed": false,
  "build_volume_mm": [
    250,
    210,
    220
  ],
  "nozzle_diameters": [
    0.25,
    0.4,
    0.6
  ],
  "max_nozzle_temp_c": 300,
  "max_bed_temp_c": 120,
  "supports": {},
  "safe_speed_ranges": {},
  "material_presets": {},
  "id": "prusa_mk3s_compat",
  "brand": "Prusa",
  "model": "Original Prusa MK3S+",
  "type": "FDM",
  "aliases": [
    "MK3S+"
  ]
}