{
  "motion_system": "CoreXY",
  "enclosed": false,
  "build_volume_mm": [
    360,
    360,
    360
  ],
  "nozzle_diameters": [
    0.25,
    0.4,
    0.6
  ],
  "max_nozzle_temp_c": 300,
  "max_bed_temp_c": 120,
  "supports": {
    "idex": false
  },
  "safe_speed_ranges": {},
  "material_presets": {},
  "id": "prusa_xl",
  "brand": "Prusa",
  "model": "Prusa XL (Toolchanger)",
  "type": "FDM"
}