{
  "spindle_rpm_range": [
    200,
    10000
  ],
  "rigidity_class": "light_industrial",
  "id": "tormach_pcnc440",
  "brand": "Tormach",
  "model": "PCNC 440",
  "type": "CNC_Mill",
  "material_presets": {},
  "supports": {},
  "safe_speed_ranges": {},
  "workarea_mm": [
    254,
    165,
    254
  ]
}