{
  "motion_system": "BedSlinger",
  "enclosed": false,
  "nozzle_diameters": [
    0.4
  ],
  "max_nozzle_temp_c": 260,
  "max_bed_temp_c": 100,
  "id": "artillery_sidewinder_x2",
  "brand": "Generic",
  "model": "Sidewinder X2",
  "type": "FDM",
  "material_presets": {},
  "supports": {},
  "safe_speed_ranges": {},
  "build_volume_mm": [
    300,
    300,
    400
  ]
}