{
  "motion_system": "CoreXY",
  "enclosed": true,
  "build_volume_mm": [
    350,
    350,
    350
  ],
  "nozzle_diameters": [
    0.4,
    0.6
  ],
  "max_nozzle_temp_c": 300,
  "max_bed_temp_c": 110,
  "supports": {},
  "safe_speed_ranges": {},
  "material_presets": {},
  "id": "creality_k2_plus",
  "brand": "Creality",
  "model": "K2 Plus",
  "type": "FDM"
}