{
  "spindle_rpm_range": [
    8000,
    20000
  ],
  "max_feed_mm_min": 6000,
  "rigidity_class": "hobby",
  "id": "xcarve_pro_4x4",
  "brand": "Inventables",
  "model": "X-Carve Pro 4x4",
  "type": "CNC_Router",
  "material_presets": {},
  "supports": {},
  "safe_speed_ranges": {},
  "workarea_mm": [
    1219,
    1219,
    100
  ]
}