{
  "motion_system": "CoreXY",
  "enclosed": true,
  "build_volume_mm": [
    256,
    256,
    256
  ],
  "nozzle_diameters": [
    0.2,
    0.4,
    0.6,
    0.8
  ],
  "max_nozzle_temp_c": 300,
  "max_bed_temp_c": 120,
  "supports": {},
  "safe_speed_ranges": {},
  "material_presets": {},
  "capabilities": [
    "lidar_flow",
    "chamber_camera"
  ],
  "id": "bambu_x1c",
  "brand": "Bambu Lab",
  "model": "X1 Carbon",
  "type": "FDM"
}